<?xml version="1.0" encoding="ISO-8859-1" standalone="no"?>
<!DOCTYPE REPORT SYSTEM "PHPReport.dtd">
<REPORT NUMBERFORMATEX="2">
	<TITLE>Sales Report</TITLE>
   <BACKGROUND_COLOR>#FFFFFF</BACKGROUND_COLOR>
<!--   <CSS>phpreports.css</CSS>  -->
   <PAGE BORDER="1" SIZE="2500" CELLSPACING="0" CELLPADDING="5" ALIGN="CENTER" WIDTH="500">
      <HEADER>
         <ROW>
            <COL COLSPAN="5" CELLCLASS="PAGE_LAYER" TEXTCLASS="BOLD">Sales in total</COL>
         </ROW>
      </HEADER>		
   </PAGE>
	<GROUPS>
      <GROUP NAME="citygroup" >

			<FIELDS>
				<ROW>
					<COL TYPE="FIELD" CELLCLASS="GROUP_LAYER">total</COL>
				</ROW>
			</FIELDS>
		</GROUP>
	</GROUPS>
</REPORT>
