<?xml version="1.0" encoding="ISO-8859-1" standalone="no"?>
<!DOCTYPE REPORT SYSTEM "PHPReport.dtd">
<REPORT NUMBERFORMATEX="2">
	<TITLE>Sales Report</TITLE>
   <BACKGROUND_COLOR>#FFFFFF</BACKGROUND_COLOR>
<!--   <CSS>phpreports.css</CSS> -->
   <PAGE BORDER="1" SIZE="25" CELLSPACING="0" CELLPADDING="5" ALIGN="CENTER" WIDTH="500">
      <HEADER>
         <ROW>
            <COL COLSPAN="6" CELLCLASS="PAGE_LAYER" TEXTCLASS="BOLD">Totals by Aging periods</COL>
	 </ROW>
	 <ROW>
            <COL COLSPAN="1" CELLCLASS="PAGE_LAYER" TEXTCLASS="BOLD">Total</COL>
            <COL COLSPAN="1" CELLCLASS="PAGE_LAYER" TEXTCLASS="BOLD">Paid</COL>
            <COL COLSPAN="1" CELLCLASS="PAGE_LAYER" TEXTCLASS="BOLD">Owing</COL>
            <COL COLSPAN="1" CELLCLASS="PAGE_LAYER" TEXTCLASS="BOLD">Aging</COL>
         </ROW>
      </HEADER>		
      <FOOTER>
	<ROW>
            <COL ALIGN="LEFT" COLSPAN="5" CELLCLASS="PAGE_LAYER">Sum</COL>
	</ROW>
         <ROW>
            <COL ALIGN="LEFT" NUMBERFORMATEX="2" CELLCLASS="PAGE_LAYER" TEXTCLASS="BOLD" TYPE="EXPRESSION">$this->getSum("inv_total")</COL>
            <COL ALIGN="LEFT" NUMBERFORMATEX="2" CELLCLASS="PAGE_LAYER" TEXTCLASS="BOLD" TYPE="EXPRESSION">$this->getSum("inv_paid")</COL>
            <COL ALIGN="LEFT" NUMBERFORMATEX="2" CELLCLASS="PAGE_LAYER" TEXTCLASS="BOLD" TYPE="EXPRESSION">$this->getSum("inv_owing")</COL>
            <COL ALIGN="RIGHT" COLSPAN="5" CELLCLASS="PAGE_LAYER"></COL>
         </ROW>
      </FOOTER>		
   </PAGE>
	<GROUPS>
      <GROUP NAME="citygroup" >

			<FIELDS>
				<ROW>
					<COL TYPE="FIELD" CELLCLASS="GROUP_LAYER">inv_total</COL>
					<COL TYPE="FIELD" CELLCLASS="GROUP_LAYER">inv_paid</COL>
					<COL TYPE="FIELD" CELLCLASS="GROUP_LAYER">inv_owing</COL>
					<COL TYPE="FIELD" CELLCLASS="GROUP_LAYER">aging</COL>
				</ROW>
			</FIELDS>
		</GROUP>
	</GROUPS>
</REPORT>
